{
  "event_name": "TECHNIMBLE 2025",
  "event_type": "Technical Fest / Competition",
  "department": "NADIMPALLI SATYANARAYANA RAJU INSTITUTE OF TECHNOLOGY (NSRIT) AUTONOMOUS",
  "dates": {
    "event_date": "01-03-2025",
    "end_date": null,
    "registration_deadline": null,
    "abstract_submission": null
  },
  "time": null,
  "venue": "NSRIT, Sontyam, Pendurthi-Anandapuram Highway, Visakhapatnam- 531173",
  "description": "A comprehensive technical and management fest, 'TECHNIMBLE 2025', organized by NSRIT. The event features a variety of activities including Poster Presentations, Paper Presentations, Project Expos, Technical Quizzes, Modeling & 3D Printing, Technical Treasure Hunts, Bridge Bust, B-Quiz, Ad-Mad, and Startup Idea competitions across multiple disciplines.",
  "registration_fee": "â‚¹300 per head per event",
  "contact_persons": [
    {
      "name": "A.Suraj Kumar",
      "role": "Faculty Coordinator (CSE)",
      "phone": "9866041929",
      "email": null
    },
    {
      "name": "K.Ramanaji",
      "role": "Faculty Coordinator (ECE)",
      "phone": "9866418529",
      "email": null
    },
    {
      "name": "M.Swathi",
      "role": "Faculty Coordinator (EEE)",
      "phone": "8500900559",
      "email": null
    },
    {
      "name": "K.Ram Prasad",
      "role": "Faculty Coordinator (MECH)",
      "phone": "7569323977",
      "email": null
    },
    {
      "name": "G.Chanikya",
      "role": "Faculty Coordinator (CIVIL)",
      "phone": "7997263378",
      "email": null
    },
    {
      "name": "T.Narayan Rao",
      "role": "Faculty Coordinator (MBA)",
      "phone": "8143911386",
      "email": null
    },
    {
      "name": "DR.T.V.S. Sri Ram",
      "role": "Faculty Coordinator (MCA)",
      "phone": "9440240968",
      "email": null
    },
    {
      "name": "CH.Hari Kiran",
      "role": "Student Coordinator (CSE)",
      "phone": "9491645242",
      "email": null
    },
    {
      "name": "S.S.Datta",
      "role": "Student Coordinator (ECE)",
      "phone": "9515071232",
      "email": null
    },
    {
      "name": "S.Yogendhra",
      "role": "Student Coordinator (EEE)",
      "phone": "6301243178",
      "email": null
    },
    {
      "name": "V.Madhav",
      "role": "Student Coordinator (MECH)",
      "phone": "9392022184",
      "email": null
    },
    {
      "name": "K Praveen Kumar",
      "role": "Student Coordinator (CIVIL)",
      "phone": "7032518818",
      "email": null
    },
    {
      "name": "R.Monika",
      "role": "Student Coordinator (MBA)",
      "phone": "9440761843",
      "email": null
    },
    {
      "name": "V.Rajesh",
      "role": "Student Coordinator (MCA)",
      "phone": "9110308571",
      "email": null
    }
  ],
  "prizes": "Exciting Prizes",
  "topics": [
    "Poster Presentation",
    "Paper Presentation",
    "Project Expo",
    "Technical Quiz",
    "Modeling & 3D Printing",
    "Technical Treasure Hunt",
    "Bridge Bust",
    "B-Quiz",
    "Ad-Mad",
    "Startup Idea"
  ],
  "target_audience": "Students from various engineering and management disciplines (CSE, CSD, CSM, ECE, EEE, MECH, CIVIL, MBA, MCA)",
  "additional_info": "Conveners: Dr.A.S.S.V. Ram Kumar, Dr.V. Sreerama Murthy. Coordinator: Sri. N. Viswanadha Reddy. The institute is accredited by NBA (National Board of Accreditation). Registration can be done by scanning the provided QR code.",
  "raw_text": "NSRIT AUTONOMOUS NADIMPALLI SATYANARAYANA RAJU INSTITUTE OF TECHNOLOGY SONTYAM, PENDHURTHI-ANANDAPURAM HIGHWAY, VISAKHAPATNAM- 531173 MAR 01st TECHNIMBLE 2025 CSE/CSD/CSM ECE MECH EEE CIVIL MBA POSTER PRESENTATION PAPER PRESENTATION PROJECT EXPO TECHNICAL QUIZ MODELING & 3D PRINTING TECHNICAL TREASURE HUNT BRIDGE BUST B-QUIZ AD-MAD STARTUP IDEA WIN EXCITING PRIZES Register Here FACULTY COORDINATES A.Suraj Kumar (CSE) 9866041929 K.Ramanaji (ECE) 9866418529 M.Swathi (EEE) 8500900559 K.Ram Prasad (MECH) 7569323977 G.Chanikya (CIVIL) 7997263378 T.Narayan Rao (MBA) 8143911386 DR.T.V.S. Sri Ram (MCA) 9440240968 STUDENT COORDINATES CH.Hari Kiran (CSE) 9491645242 S.S.Datta (ECE) 9515071232 S.Yogendhra (EEE) 6301243178 V.Madhav (MECH) 9392022184 K Praveen Kumar (CIVIL) 7032518818 R.Monika (MBA) 9440761843 V.Rajesh (MCA) 9110308571 REGISTRATION FEE 300/- PER HEAD PER EVENT Conveners: Dr.A.S.S.V. Ram Kumar, Dr.V. Sreerama Murthy Coordinator: Sri. N. Viswanadha Reddy NBA Accredited by National Board of Accreditation",
  "source_page": 2,
  "source_file": "events_photos.pdf",
  "processed_at": "2026-02-12T17:31:04.012011"
}