{
  "event_name": "TECHNIMBLE 2025",
  "event_type": "Technical Fest",
  "department": "NADIMPALLI SATYANARAYANA RAJU INSTITUTE OF TECHNOLOGY (NSRIT AUTONOMOUS)",
  "dates": {
    "event_date": "01-03-2025",
    "end_date": null,
    "registration_deadline": null,
    "abstract_submission": null
  },
  "time": null,
  "venue": "NSRIT, Sontyam, Pendhurthi-Anandapuram Highway, Visakhapatnam- 531173",
  "description": "TECHNIMBLE 2025 is a technical fest organized by NSRIT, offering a platform for students to showcase their skills and knowledge through various events like Poster Presentation, Paper Presentation, Project Expo, Technical Quiz, Modeling & 3D Printing, Technical Treasure Hunt, Bridge Bust, B-Quiz, Ad-Mad, and Startup Idea competition. Participants stand a chance to win exciting prizes.",
  "registration_fee": "INR 200 per head per event",
  "contact_persons": [
    {
      "name": "Dr.A.S.S.V. Ram Kumar",
      "role": "Convener",
      "phone": null,
      "email": null
    },
    {
      "name": "Dr.V. Sreerama Murthy",
      "role": "Convener",
      "phone": null,
      "email": null
    },
    {
      "name": "Sri. N. Viswanadha Reddy",
      "role": "Coordinator",
      "phone": null,
      "email": null
    },
    {
      "name": "A.Suraj Kumar",
      "role": "Faculty Coordinator (CSE)",
      "phone": "9866041929",
      "email": null
    },
    {
      "name": "K.Ramanaji",
      "role": "Faculty Coordinator (ECE)",
      "phone": "9866418529",
      "email": null
    },
    {
      "name": "M.Swathi",
      "role": "Faculty Coordinator (EEE)",
      "phone": "8500900559",
      "email": null
    },
    {
      "name": "K.Ram Prasad",
      "role": "Faculty Coordinator (MECH)",
      "phone": "7569323977",
      "email": null
    },
    {
      "name": "G.Chanikya",
      "role": "Faculty Coordinator (CIVIL)",
      "phone": "7997263378",
      "email": null
    },
    {
      "name": "T.Narayan Rao",
      "role": "Faculty Coordinator (MBA)",
      "phone": "8143911386",
      "email": null
    },
    {
      "name": "DR.T.V.S. Sri Ram",
      "role": "Faculty Coordinator (MCA)",
      "phone": "9440240968",
      "email": null
    },
    {
      "name": "CH.Hari Kiran",
      "role": "Student Coordinator (CSE)",
      "phone": "9491645242",
      "email": null
    },
    {
      "name": "S.S.Datta",
      "role": "Student Coordinator (ECE)",
      "phone": "9515071232",
      "email": null
    },
    {
      "name": "S.Yogendhra",
      "role": "Student Coordinator (EEE)",
      "phone": "6301243178",
      "email": null
    },
    {
      "name": "V.Madhav",
      "role": "Student Coordinator (MECH)",
      "phone": "9392022184",
      "email": null
    },
    {
      "name": "K Praveen Kumar",
      "role": "Student Coordinator (CIVIL)",
      "phone": "7032518818",
      "email": null
    },
    {
      "name": "R.Monika",
      "role": "Student Coordinator (MBA)",
      "phone": "9440761843",
      "email": null
    },
    {
      "name": "V.Rajesh",
      "role": "Student Coordinator (MCA)",
      "phone": "9110308571",
      "email": null
    }
  ],
  "prizes": "Exciting Prizes",
  "topics": [
    "Poster Presentation",
    "Paper Presentation",
    "Project Expo",
    "Technical Quiz",
    "Modeling & 3D Printing",
    "Technical Treasure Hunt",
    "Bridge Bust",
    "B-Quiz",
    "AD-Mad",
    "Startup Idea"
  ],
  "target_audience": "Students from various engineering and management disciplines including CSE/CSD/CSM, ECE, MECH, EEE, CIVIL, MBA, and MCA.",
  "additional_info": "Registration can be done by scanning the provided QR code.",
  "raw_text": "NADIMPALLI SATYANARAYANA RAJU INSTITUTE OF TECHNOLOGY\nSONTYAM, PENDHURTHI-ANANDAPURAM HIGHWAY, VISAKHAPATNAM- 531173\nNSRIT AUTONOMOUS\nMAR 01st TECHNIMBLE 2025\nCSE/CSD/CSM | ECE | MECH | EEE | CIVIL | MBA\nPOSTER PRESENTATION | POSTER PRESENTATION | POSTER PRESENTATION | POSTER PRESENTATION | POSTER PRESENTATION | PAPER PRESENTATION\nPAPER PRESENTATION | PAPER PRESENTATION | PAPER PRESENTATION | PAPER PRESENTATION | BRIDGE BUST | B-QUIZ\nPROJECT EXPO | PROJECT EXPO | MODELING & 3D PRINTING | PROJECT EXPO | PROJECT EXPO | AD-MAD\nTECHNICAL QUIZ | TECHNICAL TREASURE HUNT | STARTUP IDEA\nREGISTRATION FEE 200/- PER HEAD PER EVENT\nWIN EXCITING PRIZES! Register Here [QR Code]\n\nFACULTY COORDINATES:\nA.Suraj Kumar (CSE) 9866041929\nK.Ramanaji (ECE) 9866418529\nM.Swathi (EEE) 8500900559\nK.Ram Prasad (MECH) 7569323977\nG.Chanikya (CIVIL) 7997263378\nT.Narayan Rao (MBA) 8143911386\nDR.T.V.S. Sri Ram (MCA) 9440240968\n\nSTUDENT COORDINATES:\nCH.Hari Kiran (CSE) 9491645242\nS.S.Datta (ECE) 9515071232\nS.Yogendhra (EEE) 6301243178\nV.Madhav (MECH) 9392022184\nK Praveen Kumar (CIVIL) 7032518818\nR.Monika (MBA) 9440761843\nV.Rajesh (MCA) 9110308571\n\nConveners: Dr.A.S.S.V. Ram Kumar, Dr.V. Sreerama Murthy\nCoordinator: Sri. N. Viswanadha Reddy\nScanned with OKEN Scanner",
  "source_file": "event_photos_folder\\events_photos.pdf",
  "source_page": 2,
  "file_type": "pdf",
  "processed_at": "2026-02-12T18:16:24.602174"
}