{
  "event_name": "Build Your Own IoT Smart Devices",
  "event_type": "Student Development Programme",
  "department": "Nadimpalli Satyanarayana Raju Institute of Technology (NSRIT)",
  "dates": {
    "event_date": "02-01-2026",
    "end_date": "06-01-2026",
    "registration_deadline": null,
    "abstract_submission": null
  },
  "time": null,
  "venue": "Nadimpalli Satyanarayana Raju Institute of Technology, Sontyam, Visakhapatnam, Andhra Pradesh - 531173",
  "description": "This Student Development Programme aims to provide hands-on experience and knowledge to design Smart IoT Devices. Participants will learn practical methods for Microprocessor and Microcontroller, Computer organization and Architecture, Embedded C & Assembly Language. The program offers exposure to real-world IoT products, applications of IoT and embedded systems, and product design. It also includes guidance on writing and publishing research papers. Selected students will be offered a paid internship in NSRIT Start-UPS immediately.",
  "registration_fee": "500 INR",
  "contact_persons": [
    {
      "name": "Prof. S R N Reddy",
      "role": "HOD-CSE, IGDTUW, Delhi",
      "phone": null,
      "email": null
    },
    {
      "name": "Mr. Pratap Reddy",
      "role": "Product Designer, Delhi",
      "phone": null,
      "email": null
    },
    {
      "name": "Dr. PNE. Naveen",
      "role": "Lead-IIE, NSRIT",
      "phone": null,
      "email": null
    },
    {
      "name": "Dr. Rajendra Prasad",
      "role": "Faculty-EEE, NSRIT",
      "phone": null,
      "email": null
    },
    {
      "name": "Mrs. Phani Madhuri",
      "role": "Faculty-ECE, NSRIT",
      "phone": null,
      "email": null
    }
  ],
  "prizes": "Paid Internship in NSRIT Start-UPS for selected students.",
  "topics": [
    "Introduction to IoT and Its Architecture",
    "Introduction to Embedded C & Assembly",
    "Microprocessor and Microcontroller",
    "IoT and its Applications Development",
    "IoT Product Design and Mini Project",
    "Computer organization and Architecture"
  ],
  "target_audience": "2nd year students of CSE, EEE and ME. The SDP is also open to all interested students who want to understand the concepts of theory and practical applications of IoT to solve real-world problems through their designs and deployment.",
  "additional_info": "Organized by Nadimpalli Satyanarayana Raju Institute of Technology (NSRIT Autonomous). College Code: NSRT. Visit website: www.nsrit.edu.in.",
  "raw_text": "STUDENT DEVELOPMENT PROGRAMME ON BUILD YOUR OWN IOT SMART DEVICES\n02-06 JANUARY 2026\nWHY YOU SHOULD ATTEND ?\nDesign your Smart IoT Devices and Participate in various Design Contests\nLearn hands-on practical methods for Microprocessor and Microcontroller, Computer organization and Architecture, Embedded C & Assembly Language.\nGet practical exposure to IOT and design 20 real-world Products.\nUnderstand real-world applications of IoT and embedded systems and its Product Designs.\nWrite a your own Research Paper and Publish\nSelected Students will Gets The Paid Internship in NSRIT Start-UPS immediately\nPROGRAMME AIMS\nIntroduction to IoT and Its Architecture\nIntroduction to Embedded C & Assembly\nMicroprocessor and Microcontroller\nIoT and its Applications Development\nIoT Product Design and Mini Project\nWHO SHOULD ATTEND\nstudents of 2nd year of CSE, EEE and ME. The SDP is open to all interested students who wants to understand the concepts of theory and its practical's together and use the same skills to solve the real world problems through their designs and deploy.\nRESOURCE PERSONS\nProf. S R N Reddy- HOD-CSE, IGDTUW, Delhi\nMr. Pratap Reddy- Product Designer, Delhi\nDr. PNE. Naveen-Lead-IIE, NSRIT\nDr. Rajendra Prasad- Faculty-EEE, NSRIT\nMrs. Phani Madhuri- Faculty-ECE, NSRIT\nREGISTRATION FEE 500 â‚¹\nNadimpalli Satyanarayana Raju Institute of Technology Sontyam, Visakhapatnam, Andhra Pradesh - 531173\nNSRIT AUTONOMOUS COLLEGE CODE NSRT\nVisit Our Website www.nsrit.edu.in\nScanned with OKEN Scanner",
  "source_page": 10,
  "source_file": "events_photos.pdf",
  "processed_at": "2026-02-12T17:34:16.514192"
}